{
  "schema_version": "0.1.0",
  "titulo": "Ciclo XVIII — Ironwood, a sociedade que resiste",
  "estado": "dossie_sociohistorico_proposto",
  "aprovacao_autoral": false,
  "efeito_canonico_automatico": false,
  "lugar": "Ironwood",
  "localizacao_documentada": "Fortaleza ranger ao sul das Montanhas de Thargrid",
  "id_lugar_geografico": null,
  "id_regiao_geografica": null,
  "lideranca_militar_documentada": "Elara Stormoak",
  "fonte_autoral": "fontes/autoria/hack-carcaca-dw-capitulo-i.paginas.json",
  "fatos_documentados": [
    {
      "fonte": {
        "pagina": 6,
        "afirmacao_contextual": "Fortaleza dos rangers ao sul de Thargrid.",
        "estado": "manuscrito_em_revisao"
      },
      "afirmacao": "Ironwood se situa ao sul das Montanhas de Thargrid."
    },
    {
      "fonte": {
        "pagina": 7,
        "afirmacao_contextual": "Resistência descentralizada sem liderança universal.",
        "estado": "manuscrito_em_revisao"
      },
      "afirmacao": "Ironwood é um polo independente de resistência."
    },
    {
      "fonte": {
        "pagina": 18,
        "afirmacao_contextual": "Elara lidera companhias ranger.",
        "estado": "manuscrito_em_revisao"
      },
      "afirmacao": "Elara Stormoak lidera Ironwood e sua atividade ranger."
    },
    {
      "fonte": {
        "pagina": 18,
        "afirmacao_contextual": "Ações são ponderadas para não arriscar aldeias.",
        "estado": "manuscrito_em_revisao"
      },
      "afirmacao": "Os rangers consideram o risco a civis ao decidir atacar."
    },
    {
      "fonte": {
        "pagina": 18,
        "afirmacao_contextual": "Apoio de humanos, meio-elfos, feéricos, gnomos e refugiados.",
        "estado": "manuscrito_em_revisao"
      },
      "afirmacao": "A resistência não é composta apenas de elfos da floresta."
    },
    {
      "fonte": {
        "pagina": 20,
        "afirmacao_contextual": "Gnomos da floresta colaboram com rangers e usam ilusões.",
        "estado": "manuscrito_em_revisao"
      },
      "afirmacao": "Gnomos da floresta podem ser aliados em Ironwood."
    },
    {
      "fonte": {
        "pagina": 24,
        "afirmacao_contextual": "Tradições élficas de Rillifane, Sehanine e Corellon.",
        "estado": "manuscrito_em_revisao"
      },
      "afirmacao": "Fé entre os elfos da floresta é plural."
    }
  ],
  "limites": [
    "Ironwood não possui ID próprio em data/regioes_carcaca.json ou data/lugares_carcaca.json; não inventar identificador canônico nem associar a Eldroth.",
    "A liderança de Elara é ranger e militar; não prova poder civil total, título régio ou comando de Thargrid.",
    "Não inventar escola, parlamento, conselho, guilda, imposto, quota, oficina, população ou orçamento como instituição existente.",
    "Comandos, pactos e modelos de deliberação são alternativas, não legislação em vigor.",
    "A origem de uma pessoa não determina lealdade e não estabelece direitos ou desvantagens por raça.",
    "Ironwood não é subordinada a Thargrid; a relação militar não prova tratado ou comércio específico.",
    "Gnomos, refugiados e elfos têm tradições e vontades próprias; não atribuir fidelidade universal nem localização de refúgios.",
    "Aprender trilhas não comprova treinamento militar compulsório ou uso de crianças em missões.",
    "Nenhuma rota, tempo de viagem, procedimento clandestino operacional, esconderijo ou ponto de apoio foi inventado.",
    "Não impor culto religioso oficial nem rito idêntico entre culturas.",
    "Vinhetas e dilemas não ocorreram, não têm desfecho, nomes ou efeito de campanha.",
    "Não modificar nenhum monstro canônico ou regra de Dungeon World."
  ],
  "contagens": {
    "eixos": 8,
    "modelos_governanca": 3,
    "relacoes_diplomaticas": 4,
    "circuitos_de_cuidado": 4,
    "dilemas": 4,
    "vinhetas": 4,
    "decisoes": 8
  },
  "eixos_sociais": [
    {
      "id": "worldbuilding-xviii:eixo:reservas",
      "nome_editorial": "O alimento antes do arco",
      "tema_social": "subsistencia",
      "base_documental_e_limite": "A produção e os estoques não são descritos, mas uma fortaleza e seus protegidos precisam de sustento.",
      "tensao_social": "O prestígio da guerrilha pode eclipsar quem produz, conserva e serve alimento.",
      "pergunta_autoral": "Quem divide comida entre crianças, patrulheiros e refugiados?",
      "exemplo_de_pratica_candidata": "Deliberar sobre a responsabilidade coletiva, permitir contestação civil e preservar a autonomia das pessoas afetadas sem criar instituição específica.",
      "fonte_contextual": {
        "pagina": 7,
        "afirmacao_contextual": "A produção e os estoques não são descritos, mas uma fortaleza e seus protegidos precisam de sustento.",
        "estado": "manuscrito_em_revisao"
      },
      "estado": "proposta_de_historia_social",
      "instituicao_documentada": false,
      "recurso_quantificado": null
    },
    {
      "id": "worldbuilding-xviii:eixo:oficios",
      "nome_editorial": "Quem repara a vitória",
      "tema_social": "trabalho",
      "base_documental_e_limite": "Roupas, abrigos e objetos usados requerem cuidado, mas nenhuma oficina ou guilda é documentada.",
      "tensao_social": "O trabalho civil pode ser imposto em nome da sobrevivência coletiva.",
      "pergunta_autoral": "Quem responde pelos danos e reparos de uma missão?",
      "exemplo_de_pratica_candidata": "Deliberar sobre a responsabilidade coletiva, permitir contestação civil e preservar a autonomia das pessoas afetadas sem criar instituição específica.",
      "fonte_contextual": {
        "pagina": 7,
        "afirmacao_contextual": "Roupas, abrigos e objetos usados requerem cuidado, mas nenhuma oficina ou guilda é documentada.",
        "estado": "manuscrito_em_revisao"
      },
      "estado": "proposta_de_historia_social",
      "instituicao_documentada": false,
      "recurso_quantificado": null
    },
    {
      "id": "worldbuilding-xviii:eixo:infancia",
      "nome_editorial": "Aprender trilhas sem nascer soldado",
      "tema_social": "educacao",
      "base_documental_e_limite": "O manuscrito afirma que crianças aprendem trilhas antes de mapas; não descreve escolas nem recrutamento.",
      "tensao_social": "A proteção do bosque pode ser confundida com treinamento militar obrigatório.",
      "pergunta_autoral": "Ensinar caminhos é educar uma criança ou prepará-la compulsoriamente para guerrear?",
      "exemplo_de_pratica_candidata": "Deliberar sobre a responsabilidade coletiva, permitir contestação civil e preservar a autonomia das pessoas afetadas sem criar instituição específica.",
      "fonte_contextual": {
        "pagina": 18,
        "afirmacao_contextual": "O manuscrito afirma que crianças aprendem trilhas antes de mapas; não descreve escolas nem recrutamento.",
        "estado": "manuscrito_em_revisao"
      },
      "estado": "proposta_de_historia_social",
      "instituicao_documentada": false,
      "recurso_quantificado": null
    },
    {
      "id": "worldbuilding-xviii:eixo:acolhimento",
      "nome_editorial": "A casa de quem chegou ontem",
      "tema_social": "refugio",
      "base_documental_e_limite": "Refugiados de Eldroth mantêm vínculos com a resistência; nenhuma política de asilo é comprovada.",
      "tensao_social": "A gratidão exigida por acolhimento pode se transformar em dependência.",
      "pergunta_autoral": "Quando um refugiado deixa de ser hóspede para integrar a comunidade?",
      "exemplo_de_pratica_candidata": "Deliberar sobre a responsabilidade coletiva, permitir contestação civil e preservar a autonomia das pessoas afetadas sem criar instituição específica.",
      "fonte_contextual": {
        "pagina": 17,
        "afirmacao_contextual": "Refugiados de Eldroth mantêm vínculos com a resistência; nenhuma política de asilo é comprovada.",
        "estado": "manuscrito_em_revisao"
      },
      "estado": "proposta_de_historia_social",
      "instituicao_documentada": false,
      "recurso_quantificado": null
    },
    {
      "id": "worldbuilding-xviii:eixo:governo",
      "nome_editorial": "O comando de Elara e a voz dos demais",
      "tema_social": "autoridade",
      "base_documental_e_limite": "Elara lidera rangers, mas o governo civil formal não está descrito.",
      "tensao_social": "A disciplina de combate pode conferir poderes demais ao comando.",
      "pergunta_autoral": "Quem decide questões civis quando a decisão militar ameaça vidas e moradias?",
      "exemplo_de_pratica_candidata": "Deliberar sobre a responsabilidade coletiva, permitir contestação civil e preservar a autonomia das pessoas afetadas sem criar instituição específica.",
      "fonte_contextual": {
        "pagina": 18,
        "afirmacao_contextual": "Elara lidera rangers, mas o governo civil formal não está descrito.",
        "estado": "manuscrito_em_revisao"
      },
      "estado": "proposta_de_historia_social",
      "instituicao_documentada": false,
      "recurso_quantificado": null
    },
    {
      "id": "worldbuilding-xviii:eixo:religiao",
      "nome_editorial": "Fé que não precisa de um templo único",
      "tema_social": "religiao",
      "base_documental_e_limite": "Rillifane, Sehanine e Corellon integram tradições élficas; não há religião oficial de Ironwood.",
      "tensao_social": "Ritos de diferentes povos podem ser apagados por uma identidade militar uniforme.",
      "pergunta_autoral": "Quem pode impor limites religiosos a uma decisão de segurança?",
      "exemplo_de_pratica_candidata": "Deliberar sobre a responsabilidade coletiva, permitir contestação civil e preservar a autonomia das pessoas afetadas sem criar instituição específica.",
      "fonte_contextual": {
        "pagina": 24,
        "afirmacao_contextual": "Rillifane, Sehanine e Corellon integram tradições élficas; não há religião oficial de Ironwood.",
        "estado": "manuscrito_em_revisao"
      },
      "estado": "proposta_de_historia_social",
      "instituicao_documentada": false,